...1,id,condition,response,response_clean,item,item_clean,SemDis_cbowukwacsubtitle_c_m,SemDis_cbowsubtitle_c_m,SemDis_cbowBNCwikiukwac_c_m,SemDis_TASA_c_m,SemDis_glove_c_m,SemDis_MEAN,SemDis_factor
108,109,creative,Use a tin can to make a portable lantern by filling it with sand and placing a tea light inside,use a tin can to make a portable lantern by filling it with sand and placing a tea light inside,tin can,tin can,0.95751,0.96592,1.01287,0.80093,0.36294000000000004,0.82003,-0.01766
109,110,creative,Use a tin can to store small items such as pens pencils or craft supplies,use a tin can to store small items such as pens pencils or craft supplies,tin can,tin can,1.15224,1.0359,1.13624,0.80095,0.37233000000000005,0.89953,0.08569
110,111,creative,Use a tin can to make a DIY speaker by attaching a small speaker to the inside of the can,use a tin can to make a diy speaker by attaching a small speaker to the inside of the can,tin can,tin can,0.8656,0.96154,1.00452,0.80093,1.63323,1.05316,-0.02778
111,112,creative,Use a tin can to make a miniature aquarium by lining the bottom with a plastic lid and filling it with water and a few small fish,use a tin can to make a miniature aquarium by lining the bottom with a plastic lid and filling it with water and a few small fish,tin can,tin can,1.15135,1.02375,1.01099,0.80093,0.362,0.8698,0.06819
112,113,creative,Here are some creative uses for a tin can,here are some creative uses for a tin can,tin can,tin can,0.86233,1.07278,1.06319,0.79793,1.65929,1.0911,-0.01773
113,114,creative,Planter Turn a tin can into a planter by painting it and adding some drainage holes,planter turn a tin can into a planter by painting it and adding some drainage holes,tin can,tin can,1.16112,1.24712,0.95084,0.80093,0.6538200000000001,0.96277,0.07711
114,115,creative,Pencil holder Use an empty tin can as a simple stylish pencil holder,pencil holder use an empty tin can as a simple stylish pencil holder,tin can,tin can,1.2719,0.97811,1.03876,0.8018000000000001,0.5837,0.93485,0.12878
115,116,creative,Organizer Use several tin cans to organize small items like pens pencils and craft supplies,organizer use several tin cans to organize small items like pens pencils and craft supplies,tin can,tin can,1.12027,0.95915,0.93533,0.80393,0.36229,0.83619,0.042659999999999997
116,117,creative,Lantern Decorate a tin can with colorful paper and turn it into a lantern,lantern decorate a tin can with colorful paper and turn it into a lantern,tin can,tin can,0.84921,0.94426,1.01273,0.80091,0.36238000000000004,0.7939,-0.06555
117,118,creative,Wind chime Use a few tin cans to create a wind chime,wind chime use a few tin cans to create a wind chime,tin can,tin can,1.15039,0.94587,0.9698599999999999,0.80626,0.36665000000000003,0.84781,0.05988
118,119,creative,Bird feeder Create a bird feeder by punching a few holes in the side of an empty tin can,bird feeder create a bird feeder by punching a few holes in the side of an empty tin can,tin can,tin can,1.05307,0.95037,0.99073,0.80093,1.6378599999999999,1.08659,0.05217
119,120,creative,Speaker Turn a tin can into a speaker by punching a small hole in it and attaching a speaker to it,speaker turn a tin can into a speaker by punching a small hole in it and attaching a speaker to it,tin can,tin can,1.06877,0.96203,0.95173,0.80093,1.6463999999999999,1.08597,0.05437
120,121,creative,Candle holder Use an empty tin can as a candle holder by attaching a candle to the inside of the can,candle holder use an empty tin can as a candle holder by attaching a candle to the inside of the can,tin can,tin can,1.15128,0.93188,0.98351,0.80082,1.6373600000000001,1.10097,0.09369
121,122,creative,Watering can Use a tin can as a watering can by attaching a hose to the top,watering can use a tin can as a watering can by attaching a hose to the top,tin can,tin can,1.13808,1.1151200000000001,0.95569,0.80095,1.63792,1.12955,0.08869
122,123,creative,Serving dish Use an empty tin can as a serving dish for snacks or desserts,serving dish use an empty tin can as a serving dish for snacks or desserts,tin can,tin can,1.14878,0.83222,1.07527,0.80079,1.63662,1.09874,0.1023
123,124,creative,Decorative piece Use an empty tin can as a decorative piece by painting it or adding embellishments,decorative piece use an empty tin can as a decorative piece by painting it or adding embellishments,tin can,tin can,0.84511,0.77144,1.05801,0.80098,0.36173,0.76745,-0.06557
124,125,creative,Create a pencil holder,create a pencil holder,tin can,tin can,0.78409,0.97179,0.97496,0.89363,0.35761,0.79642,-0.11022
125,126,creative,Turn it into a planter for succulents or other small plants,turn it into a planter for succulents or other small plants,tin can,tin can,1.04286,1.04132,0.94436,0.80095,1.70114,1.10613,0.04534
126,127,creative,Create a DIY bird feeder by attaching sticks to the outside and filling it with seeds,create a diy bird feeder by attaching sticks to the outside and filling it with seeds,tin can,tin can,0.94644,0.96203,1.06365,0.80094,0.36090999999999995,0.82679,-0.01593
127,128,creative,Use it as a storage container for small items like pens pencils or craft supplies,use it as a storage container for small items like pens pencils or craft supplies,tin can,tin can,1.15174,0.94059,0.94178,0.80094,0.38002,0.84301,0.05763
128,129,creative,Paint it and turn it into a decorative piece of home decor,paint it and turn it into a decorative piece of home decor,tin can,tin can,0.85104,1.06333,1.04146,0.80093,0.31113,0.81358,-0.05932
129,130,creative,Use it as a portable ashtray for smokers,use it as a portable ashtray for smokers,tin can,tin can,1.00634,0.99737,1.01824,0.80287,1.64022,1.09301,0.03634
130,131,creative,Turn it into a DIY lantern by attaching a string or wire to the top and hanging it from a tree or other structure,turn it into a diy lantern by attaching a string or wire to the top and hanging it from a tree or other structure,tin can,tin can,0.85597,0.95456,0.94261,0.80093,1.6403699999999999,1.03889,-0.04017
131,132,creative,Use it as a storage container for dried goods like pasta beans or rice,use it as a storage container for dried goods like pasta beans or rice,tin can,tin can,0.84686,1.00868,0.94268,0.80107,0.34848999999999997,0.78956,-0.07464
132,133,creative,Use it as a portable lantern by filling it with sand and lighting a candle inside,use it as a portable lantern by filling it with sand and lighting a candle inside,tin can,tin can,0.96622,0.96515,1.01399,0.80093,0.35702999999999996,0.82066,-0.01387
133,134,creative,Use it as a portable speaker by attaching a small speaker to the inside of it,use it as a portable speaker by attaching a small speaker to the inside of it,tin can,tin can,0.99426,1.03776,1.02173,0.80093,0.32582,0.8361,4e-4
134,135,creative,Here are a few ideas for creative uses for a tin can,here are a few ideas for creative uses for a tin can,tin can,tin can,1.18955,1.02965,0.99575,0.80105,0.35229,0.87366,0.08276
135,136,creative,1 As a planter Cut a can in half and fill it with soil to create a small planter for growing herbs or flowers,as a planter cut a can in half and fill it with soil to create a small planter for growing herbs or flowers,tin can,tin can,0.84868,0.96973,0.9358,0.80093,1.63846,1.03872,-0.04394
136,137,creative,2 As a storage container Use a can to organize small items such as craft supplies or office supplies,as a storage container use a can to organize small items such as craft supplies or office supplies,tin can,tin can,0.84866,1.00773,0.97539,0.80169,0.35748,0.79819,-0.0694
137,138,creative,3 As a utensil holder Use a can to hold kitchen utensils such as knives forks and spoons,as a utensil holder use a can to hold kitchen utensils such as knives forks and spoons,tin can,tin can,1.1554,1.04525,0.94289,0.80093,0.35346,0.85959,0.06126
138,139,creative,4 As a piggy bank Decorate a can with your child's favorite characters and use it to teach the value of saving,as a piggy bank decorate a can with your childs favorite characters and use it to teach the value of saving,tin can,tin can,1.00739,0.96194,0.98137,0.80093,0.362,0.82273,-1.5e-4
139,140,creative,5 As a lantern Cut a can in half and use it as a candle holder for small candles,as a lantern cut a can in half and use it as a candle holder for small candles,tin can,tin can,0.84211,0.91735,1.00965,0.80093,0.36214,0.78644,-0.06972
140,141,creative,6 As a musical instrument Use a can as a drum or a tambourine,as a musical instrument use a can as a drum or a tambourine,tin can,tin can,0.81311,1.03794,0.95553,0.80092,0.35717,0.79293,-0.08674
141,142,creative,7 As a bird feeder Decorate a can with birdseed and place it outside to attract birds to your yard,as a bird feeder decorate a can with birdseed and place it outside to attract birds to your yard,tin can,tin can,1.08577,1.07353,1.00969,0.80094,1.63781,1.12155,0.07195
142,143,creative,8 As a storage container for snacks Use a small can to store nuts crackers or other snacks,as a storage container for snacks use a small can to store nuts crackers or other snacks,tin can,tin can,1.15101,1.00749,1.0575,0.80094,1.63689,1.13077,0.10516
143,144,creative,9 As a vase Cut a can in half and use it as a holder for flowers,as a vase cut a can in half and use it as a holder for flowers,tin can,tin can,0.84782,0.95006,1.01481,0.80093,1.65725,1.05417,-0.03388
144,145,creative,10 As a lantern Cut a can in half and use it as a candle holder for small candles,as a lantern cut a can in half and use it as a candle holder for small candles,tin can,tin can,0.84211,0.91735,1.00965,0.80093,0.36214,0.78644,-0.06972
145,146,creative,1 Turn it into a pen holder,turn it into a pen holder,tin can,tin can,0.87843,0.94811,0.92681,0.8036300000000001,0.32458,0.77630999999999994,-0.06532
146,147,creative,2 Use it as a kitchen storage container,use it as a kitchen storage container,tin can,tin can,1.12379,1.03745,0.94099,0.79026,1.68618,1.1157300000000001,0.08116
147,148,creative,3 Paint it and use it as a planter,paint it and use it as a planter,tin can,tin can,1.003,1.04808,0.94643,0.80093,1.57584,1.07486,0.02527
148,149,creative,4 Use it as a portable speaker,use it as a portable speaker,tin can,tin can,0.9127,1.0351,1.04933,0.8046599999999999,0.2995,0.82026,-0.03278
149,150,creative,5 Transform it into a pet food and water station,transform it into a pet food and water station,tin can,tin can,1.08672,0.89869,1.04239,0.80113,1.68003,1.10179,0.07347
150,151,creative,6 Make an herb garden in it,make an herb garden in it,tin can,tin can,0.92976,0.94611,0.98861,0.79982,0.41394,0.81565,-0.03208
151,152,creative,7 Turn it into a miniature drum set,turn it into a miniature drum set,tin can,tin can,1.10063,1.06208,1.02132,0.80258,1.6456300000000001,1.12645,0.07969
152,153,creative,8 Use it as a lantern,use it as a lantern,tin can,tin can,0.8664499999999999,0.94949,0.96199,0.79793,1.40113,0.9954,-0.03866
153,154,creative,9 Make a wind chime out of it,make a wind chime out of it,tin can,tin can,1.03646,0.96602,1.04749,0.80054,1.44461,1.05902,0.04809
154,155,creative,10 Use as a base for a homemade rocket,use as a base for a homemade rocket,tin can,tin can,1.01632,1.00644,0.95591,0.80028,0.35295,0.82638,0.00133
155,156,creative,Make a tin can telephone by drilling a small hole in each can and connecting them with a piece of string,make a tin can telephone by drilling a small hole in each can and connecting them with a piece of string,tin can,tin can,0.92215,0.9761,1.01747,0.80093,1.63835,1.071,-8.8e-4
156,157,creative,Use tin cans as planters for succulents or other small plants,use tin cans as planters for succulents or other small plants,tin can,tin can,1.07963,0.86027,1.01214,0.793,0.35411000000000004,0.81983,0.03384
157,158,creative,Make a tin can wind chime by hanging several cans from a piece of wood and attaching metal spoons or other objects to the insides of the cans,make a tin can wind chime by hanging several cans from a piece of wood and attaching metal spoons or other objects to the insides of the cans,tin can,tin can,0.84867,1.03764,0.93984,0.80093,1.63781,1.05298,-0.04178
158,159,creative,Use a tin can as a pencil holder or pen holder,use a tin can as a pencil holder or pen holder,tin can,tin can,0.83724,1.20093,1.0085,0.80065,1.6892800000000001,1.10732,-0.03243
159,160,creative,Paint a tin can and use it as a storage container for art supplies,paint a tin can and use it as a storage container for art supplies,tin can,tin can,0.8435699999999999,1.10246,0.94441,0.80093,0.35152000000000005,0.80858,-0.07348
160,161,creative,Use a tin can as a candle holder or lantern,use a tin can as a candle holder or lantern,tin can,tin can,0.74986,1.12998,1.03485,0.79928,0.34379000000000004,0.81155,-0.10179
161,162,creative,Make a tin can drum by replacing the bottom of a can with a stretched piece of cloth and attaching a stick to use as a drumstick,make a tin can drum by replacing the bottom of a can with a stretched piece of cloth and attaching a stick to use as a drumstick,tin can,tin can,0.84984,0.96184,0.94262,0.80093,0.35968999999999995,0.78298,-0.07419
162,163,creative,Use a tin can as a storage container for small items such as screws or nails,use a tin can as a storage container for small items such as screws or nails,tin can,tin can,0.84865,1.25827,1.0577,0.80098,0.33958,0.86104,-0.05279
163,164,creative,Use tin cans to store your cooking utensils or to organize your pantry,use tin cans to store your cooking utensils or to organize your pantry,tin can,tin can,1.15032,0.97538,1.05111,0.8271999999999999,1.63774,1.12835,0.09993
164,165,creative,Use a tin can as a piggy bank,use a tin can as a piggy bank,tin can,tin can,0.91634,0.85605,0.93215,0.80369,0.46779000000000004,0.7952,-0.04676
165,166,creative,Use as a pencil holder,use as a pencil holder,tin can,tin can,0.72339,1.0425,0.99497,0.79171,1.68853,1.04822,-0.0867
166,167,creative,Use as a coin bank,use as a coin bank,tin can,tin can,0.93634,0.97273,1.00965,0.8254900000000001,1.6051,1.06986,2.8e-4
167,168,creative,Use as a vase for flowers,use as a vase for flowers,tin can,tin can,0.8491,0.92549,1.02002,0.80389,1.7015799999999999,1.06002,-0.03251
168,169,creative,Use as a storage container for small items such as screws nails or buttons,use as a storage container for small items such as screws nails or buttons,tin can,tin can,0.84887,1.05448,1.0574,0.80156,0.33287999999999995,0.81904,-0.05792
169,170,creative,Use as a candle holder,use as a candle holder,tin can,tin can,0.92335,0.97017,1.06579,0.79052,1.5485,1.05967,0.005
170,171,creative,Use as a watering can for plants,use as a watering can for plants,tin can,tin can,1.20402,1.01344,1.06279,0.8026,1.64377,1.14532,0.12914
171,172,creative,Use as a soap dispenser,use as a soap dispenser,tin can,tin can,1.04621,1.03834,0.95723,0.82822,0.39007000000000003,0.85201,0.01271
172,173,creative,Use as a decorative accent such as a planter or wind chime,use as a decorative accent such as a planter or wind chime,tin can,tin can,0.84988,0.93645,0.94584,0.8008,0.5776600000000001,0.82213,-0.06898
173,174,creative,Use as a portable ashtray,use as a portable ashtray,tin can,tin can,0.96327,0.94874,1.11763,0.8166599999999999,0.31389999999999996,0.83204,-0.00491
174,175,creative,Use as a musical instrument such as a drum or shaker,use as a musical instrument such as a drum or shaker,tin can,tin can,0.84995,0.97057,0.93981,0.80035,1.63949,1.04003,-0.04273
175,176,creative,Here are a few creative uses for tin cans,here are a few creative uses for tin cans,tin can,tin can,0.85286,0.87251,0.96846,0.8019000000000001,1.63617,1.02638,-0.04033
176,177,creative,1 Make a bird feeder by decorating a tin can and hanging it outside,make a bird feeder by decorating a tin can and hanging it outside,tin can,tin can,1.03324,0.88944,1.05994,0.80091,0.36478,0.82966,0.01986
177,178,creative,2 Use an empty tin can as a pot for starting seeds,use an empty tin can as a pot for starting seeds,tin can,tin can,1.0753,0.92663,1.03042,0.80063,1.63842,1.09428,0.06661
178,179,creative,3 Turn an empty tin can into a pencil holder,turn an empty tin can into a pencil holder,tin can,tin can,1.05076,0.91225,1.09018,0.7953600000000001,1.6625999999999999,1.10223,0.0647
179,180,creative,4 Use a tin can as an emergency lantern Cut a small hole in one side of the can and place a batterypowered LED light inside,use a tin can as an emergency lantern cut a small hole in one side of the can and place a batterypowered led light inside,tin can,tin can,0.84641,1.01839,0.94511,0.80093,0.3627,0.79471,-0.07391
180,181,creative,5 Make a wind chime by hanging several tin cans together,make a wind chime by hanging several tin cans together,tin can,tin can,1.1273900000000001,1.10718,0.95583,0.8110999999999999,0.36017,0.87233,0.05111
181,182,creative,6 Use an empty tin can as a storage container for small items,use an empty tin can as a storage container for small items,tin can,tin can,0.84739,0.84844,1.0565,0.80503,0.35857000000000006,0.78319,-0.0635
182,183,creative,7 Decorate an empty tin can and use it as a vase for flowers,decorate an empty tin can and use it as a vase for flowers,tin can,tin can,1.16326,1.22934,1.05749,0.80096,0.36240000000000006,0.92269,0.08454
183,184,creative,8 Make a mini herb garden by planting herbs in individual tin cans,make a mini herb garden by planting herbs in individual tin cans,tin can,tin can,0.89784,1.08502,0.92869,0.80275,0.36217,0.81529,-0.05223
184,185,creative,9 Use an empty tin can as a drum by attaching a drum stick to the top,use an empty tin can as a drum by attaching a drum stick to the top,tin can,tin can,0.84868999999999994,1.03508,1.00344,0.80103,0.36146999999999996,0.80994,-0.06484
185,186,creative,10 Use an empty tin can as a bug catcher Cut a small hole in one side of the can and place a sheet of paper inside Insects will be attracted to the can and can be easily collected and observed,use an empty tin can as a bug catcher cut a small hole in one side of the can and place a sheet of paper inside insects will be attracted to the can and can be easily collected and observed,tin can,tin can,0.84872,1.03803,1.03314,0.80093,0.36219,0.8166,-0.06079
186,187,creative,Create a DIY wind chime by hanging several tin cans together with string,create a diy wind chime by hanging several tin cans together with string,tin can,tin can,1.15633,0.93626,0.99594,0.8027,0.36295999999999995,0.85084,0.06605
187,188,creative,Turn a tin can into a pencil holder by painting it and adding a small hole on top,turn a tin can into a pencil holder by painting it and adding a small hole on top,tin can,tin can,1.10593,0.86117,1.02858,0.80094,0.35070999999999997,0.82947,0.04644
188,189,creative,Use a tin can as a planter for growing herbs or other small plants,use a tin can as a planter for growing herbs or other small plants,tin can,tin can,0.84956,1.0436,0.93037,0.80092,1.63984,1.05286,-0.04244
189,190,creative,Create a DIY lantern by punching holes in a pattern on a tin can and attaching it to a small candle,create a diy lantern by punching holes in a pattern on a tin can and attaching it to a small candle,tin can,tin can,0.84297,0.94901,0.99043,0.80093,0.36309,0.78929,-0.07109
190,191,creative,Use tin cans as storage for small items such as pens pencils or paintbrushes,use tin cans as storage for small items such as pens pencils or paintbrushes,tin can,tin can,0.84699,0.85397,1.05829,0.8022400000000001,0.36007999999999996,0.78431,-0.06291
191,192,creative,Turn a tin can into a mini speaker by attaching a speaker or headphone cord to it,turn a tin can into a mini speaker by attaching a speaker or headphone cord to it,tin can,tin can,1.1672500000000001,1.03166,1.05915,0.80093,0.34648,0.88109,0.08132
192,193,creative,Use a tin can as a soap dispenser by cutting a small hole on top and filling it with soap,use a tin can as a soap dispenser by cutting a small hole on top and filling it with soap,tin can,tin can,0.8501799999999999,0.82514,1.06661,0.80093,1.6368399999999999,1.03594,-0.02953
193,194,creative,Create a DIY bird feeder by punching holes in a pattern on a tin can and filling it with birdseed,create a diy bird feeder by punching holes in a pattern on a tin can and filling it with birdseed,tin can,tin can,1.12691,0.94083,1.00468,0.80093,1.63837,1.10234,0.08607
194,195,creative,Turn a tin can into a coin bank by cutting a small hole on top and filling it with coins,turn a tin can into a coin bank by cutting a small hole on top and filling it with coins,tin can,tin can,1.1250499999999999,0.97521,1.02078,0.80093,0.34458999999999995,0.85331,0.05638
195,196,creative,Create a DIY musical instrument by attaching objects to tin cans and using them to make sounds,create a diy musical instrument by attaching objects to tin cans and using them to make sounds,tin can,tin can,0.98083,1.04017,1.04283,0.80091,0.36133000000000004,0.84521,-0.00174
196,197,creative,Make a wind chime by hanging several tin cans from a string,make a wind chime by hanging several tin cans from a string,tin can,tin can,0.84844,0.95819,0.995,0.8008299999999999,0.36131,0.79275,-0.06791
197,198,creative,Turn a tin can into a pencil holder by painting it and adding a fun design,turn a tin can into a pencil holder by painting it and adding a fun design,tin can,tin can,1.15432,1.19962,0.87507,0.80091,0.33187,0.87236,0.05504
198,199,creative,Use tin cans as planters for small plants or herbs,use tin cans as planters for small plants or herbs,tin can,tin can,1.11609,0.8576,0.90721,0.80657,0.36117999999999995,0.80973,0.03429
199,200,creative,Make your own musical instrument like a tambourine or maracas by filling tin cans with different materials,make your own musical instrument like a tambourine or maracas by filling tin cans with different materials,tin can,tin can,1.03702,0.98232,1.04556,0.80098,1.63652,1.10048,0.05314
200,201,creative,Use tin cans as storage for small items like stationery or craft supplies,use tin cans as storage for small items like stationery or craft supplies,tin can,tin can,1.1428099999999999,0.85531,0.96921,0.85773,0.35790999999999995,0.83659,0.04754
201,202,creative,Decorate tin cans to make unique candle holders for a table centerpiece,decorate tin cans to make unique candle holders for a table centerpiece,tin can,tin can,0.95386,1.16071,1.01484,0.8008,0.36219,0.85848,-0.01427
202,203,creative,Use tin cans as containers for homemade bath products like bath salts or bath bombs,use tin cans as containers for homemade bath products like bath salts or bath bombs,tin can,tin can,1.12907,1.00753,1.0573,0.8166599999999999,1.6378,1.12967,0.09358
203,204,creative,Make tin can lanterns by painting the cans and adding a handle to use as a decoration,make tin can lanterns by painting the cans and adding a handle to use as a decoration,tin can,tin can,0.8710100000000001,1.04877,1.05729,0.80094,1.6396600000000001,1.08353,-0.01617
204,205,creative,Use tin cans as organizers for small items like nuts and bolts,use tin cans as organizers for small items like nuts and bolts,tin can,tin can,0.86929,0.88015,0.98892,0.8080499999999999,0.36319,0.78192,-0.06236
205,206,creative,Turn a tin can into a bird feeder by drilling small holes in the top and hanging it from a tree,turn a tin can into a bird feeder by drilling small holes in the top and hanging it from a tree,tin can,tin can,0.99336,1.04818,1.02113,0.80093,0.36246999999999996,0.84521,0.00109
206,207,creative,1 Transform it into a musical instrument by attaching a drumhead and drumsticks,transform it into a musical instrument by attaching a drumhead and drumsticks,tin can,tin can,1.07159,1.12253,0.95048,0.80077,0.30037,0.84915,0.02623
207,208,creative,2 Create a pinhole camera by punching a small hole in one end of the can and using a piece of photographic paper inside,create a pinhole camera by punching a small hole in one end of the can and using a piece of photographic paper inside,tin can,tin can,1.15032,0.96144,1.05274,0.80093,0.36160000000000003,0.86541,0.07174
208,209,creative,3 Use it as a portable survival stove by filling it with sand and lighting a fire inside,use it as a portable survival stove by filling it with sand and lighting a fire inside,tin can,tin can,0.93435,1.03529,1.0452,0.80094,1.63889,1.09093,0.00957
209,210,creative,4 Use it as a portable speaker by attaching a speaker to the inside of the can,use it as a portable speaker by attaching a speaker to the inside of the can,tin can,tin can,1.00392,1.03639,1.05772,0.80094,0.32432000000000005,0.84466,0.00931
210,211,creative,5 Use it as a portable lantern by attaching a light bulb and wire to the inside of the can,use it as a portable lantern by attaching a light bulb and wire to the inside of the can,tin can,tin can,1.01475,1.03764,1.08705,0.80096,0.31577,0.85123,0.01774
211,212,creative,6 Use it as a piggy bank by cutting a hole in the side of the can and using it as a container for coins,use it as a piggy bank by cutting a hole in the side of the can and using it as a container for coins,tin can,tin can,1.12362,1.0426,0.98966,0.80093,0.38651,0.86866,0.05431
212,213,creative,7 Use it as a planter by cutting out a hole in the side of the can and using it as a container for soil,use it as a planter by cutting out a hole in the side of the can and using it as a container for soil,tin can,tin can,1.07557,1.07779,0.93574,0.80093,1.67504,1.11301,0.05874
213,214,creative,8 Use it as a storage container for food or other items by leaving the lid on and using it as a container,use it as a storage container for food or other items by leaving the lid on and using it as a container,tin can,tin can,1.15115,0.99772,1.05636,0.80094,1.56514,1.11426,0.10307
