...1,id,condition,response,response_clean,item,item_clean,SemDis_cbowukwacsubtitle_c_m,SemDis_cbowsubtitle_c_m,SemDis_cbowBNCwikiukwac_c_m,SemDis_TASA_c_m,SemDis_glove_c_m,SemDis_MEAN,SemDis_factor
0,1,creative,Plant a garden You can plant a small garden in a tin can using soil seeds and a little water,plant a garden you can plant a small garden in a tin can using soil seeds and a little water,tin can,tin can,0.9912,0.96104,0.78757,0.80093,0.36219,0.78059,-0.03287
1,2,creative,Wind chime Cut the bottom off a tin can and hang it from a string to make a wind chime,wind chime cut the bottom off a tin can and hang it from a string to make a wind chime,tin can,tin can,0.84177,1.03941,1.05447,0.80093,0.34746,0.81681,-0.06134
2,3,creative,Lantern Turn a tin can into a lantern by punching holes in the side and filling it with a small candle,lantern turn a tin can into a lantern by punching holes in the side and filling it with a small candle,tin can,tin can,1.13277,1.0193699999999999,1.0119,0.80093,1.6374300000000002,1.12048,0.09147
3,4,creative,Pencil holder Use a small tin can to hold pens and pencils on your desk You can decorate the can with paint or stickers,pencil holder use a small tin can to hold pens and pencils on your desk you can decorate the can with paint or stickers,tin can,tin can,0.84851,1.03774,0.9419,0.80093,1.63781,1.05338,-0.04157
4,5,creative,Storage Use a large tin can to store small items such as craft supplies office supplies or kitchen utensils,storage use a large tin can to store small items such as craft supplies office supplies or kitchen utensils,tin can,tin can,1.15133,0.80093,0.85467,0.80072,1.63922,1.04937,0.07355
5,6,creative,Coin bank Use a small tin can as a coin bank You can decorate the can with paint or stickers then punch a hole in the top and use a rubber band to hold it shut,coin bank use a small tin can as a coin bank you can decorate the can with paint or stickers then punch a hole in the top and use a rubber band to hold it shut,tin can,tin can,0.84813,0.96346,1.01197,0.80093,0.36219,0.79734,-0.06566
6,7,creative,Bird feeder Cut holes in the side of a large tin can and attach it to a tree branch to make a bird feeder,bird feeder cut holes in the side of a large tin can and attach it to a tree branch to make a bird feeder,tin can,tin can,0.93754,0.95783,1.00897,0.80093,0.36199000000000003,0.81345,-0.02712
7,8,creative,Decoration Use small tin cans as decorations for parties or holidays by painting them and filling them with flowers or lights,decoration use small tin cans as decorations for parties or holidays by painting them and filling them with flowers or lights,tin can,tin can,0.8486400000000001,0.947,1.0609,0.80093,1.6378,1.05905,-0.02798
8,9,creative,Speakers Use a large tin can as a speaker by drilling a hole in the side and connecting it to an audio device,speakers use a large tin can as a speaker by drilling a hole in the side and connecting it to an audio device,tin can,tin can,1.14475,1.03741,1.04265,0.80093,1.64062,1.13327,0.10128
9,10,creative,Cooking You can use a tin can,cooking you can use a tin can,tin can,tin can,1.03483,0.88844,0.83773,0.79862,1.66182,1.04429,0.02334
10,11,creative,Planter Use a tin can as a planter to grow herbs flowers or a small plant,planter use a tin can as a planter to grow herbs flowers or a small plant,tin can,tin can,0.84795,1.23648,0.9333400000000001,0.80093,0.36036999999999997,0.83581,-0.06956
11,12,creative,Pencil holder Use a large tin can to store pens pencils and other office supplies,pencil holder use a large tin can to store pens pencils and other office supplies,tin can,tin can,0.96564,0.98693,1.02459,0.80092,0.37558,0.83073,-0.01173
12,13,creative,Cutlery holder Use a small tin can to store cutlery for picnics or camping trips,cutlery holder use a small tin can to store cutlery for picnics or camping trips,tin can,tin can,1.1492,0.86388,0.99985,0.8009,1.63897,1.09056,0.09332
13,14,creative,Vase Use a large tin can as a vase to display flowers or greenery,vase use a large tin can as a vase to display flowers or greenery,tin can,tin can,1.12172,1.18375,1.04263,0.80098,1.5424600000000002,1.13831,0.09235
14,15,creative,Lantern Use a small tin can as a lantern for camping or outdoor use,lantern use a small tin can as a lantern for camping or outdoor use,tin can,tin can,0.84407,0.90549,0.90568,0.80103,0.36258,0.76377,-0.0829
15,16,creative,Storage container Use a large tin can to store small items such as craft supplies in the kitchen or garage,storage container use a large tin can to store small items such as craft supplies in the kitchen or garage,tin can,tin can,0.84867,1.02172,0.78366,0.80084,0.36202,0.76338,-0.0942
16,17,creative,Wind chime Use a small tin can to make a wind chime by attaching various objects such as beads to a string and hanging it inside the can,wind chime use a small tin can to make a wind chime by attaching various objects such as beads to a string and hanging it inside the can,tin can,tin can,0.84866,1.03926,0.93346,0.80093,0.36107999999999996,0.79668,-0.074
17,18,creative,Bird feeder Use a large tin can to make a bird feeder by attaching a string or wire and placing it outside,bird feeder use a large tin can to make a bird feeder by attaching a string or wire and placing it outside,tin can,tin can,0.92283,1.04002,0.9524,0.80093,0.36177000000000004,0.81559,-0.03904
18,19,creative,Watering can Use a large tin can as a watering can for plants or flowers,watering can use a large tin can as a watering can for plants or flowers,tin can,tin can,1.15434,1.14626,0.94939,0.80093,1.63782,1.13775,0.09571
19,20,creative,Serving dish Use a large tin can as a serving dish for food or snacks,serving dish use a large tin can as a serving dish for food or snacks,tin can,tin can,1.11819,1.04951,1.04144,0.80098,1.63822,1.12967,0.08974
20,21,creative,Toy Use a small tin can as a unique toy for a child,toy use a small tin can as a unique toy for a child,tin can,tin can,0.77522,1.06567,1.06675,0.80094,1.63838,1.06939,-0.0564
21,22,creative,Here are a few creative uses for a tin can,here are a few creative uses for a tin can,tin can,tin can,1.07756,0.92243,0.9272,0.80122,0.34994000000000003,0.81567,0.02207
22,23,creative,As a piggy bank Cover the can with colorful paper decorate it with stickers and use it as a place to save money,as a piggy bank cover the can with colorful paper decorate it with stickers and use it as a place to save money,tin can,tin can,1.15182,0.96205,1.00992,0.80093,1.63781,1.11251,0.09815
23,24,creative,As a pen holder Paint or decorate the can and use it to store pens pencils and other office supplies,as a pen holder paint or decorate the can and use it to store pens pencils and other office supplies,tin can,tin can,1.07093,1.05534,0.94264,0.80093,1.63802,1.10157,0.05617
24,25,creative,As a planter Fill the can with soil and plant a small plant or succulent inside,as a planter fill the can with soil and plant a small plant or succulent inside,tin can,tin can,0.84848,0.9710799999999999,1.02502,0.80094,0.32733,0.79457,-0.06446
25,26,creative,As a storage container Use the can to store small items such as buttons beads or craft supplies,as a storage container use the can to store small items such as buttons beads or craft supplies,tin can,tin can,0.84867,1.00883,0.94224,0.80096,0.36088,0.79232,-0.07358
26,27,creative,As a musical instrument Make a small drum by attaching a stick to the inside of the can or make a maraca by filling it with beads or beans,as a musical instrument make a small drum by attaching a stick to the inside of the can or make a maraca by filling it with beads or beans,tin can,tin can,0.84909,0.96199,0.94388,0.80093,1.5916000000000001,1.0295,-0.04403
27,28,creative,As a candle holder Decorate the can with paint and glitter and use it to hold candles for a festive touch,as a candle holder decorate the can with paint and glitter and use it to hold candles for a festive touch,tin can,tin can,1.1430500000000001,1.03944,1.00045,0.80093,1.63781,1.12434,0.09494
28,29,creative,As a bird feeder Punch a few small holes in the can and fill it with birdseed to attract birds to your yard,as a bird feeder punch a few small holes in the can and fill it with birdseed to attract birds to your yard,tin can,tin can,1.13814,1.0047,0.99651,0.80093,1.63778,1.11561,0.09143
29,30,creative,As a lantern Paint the can with glowinthedark paint and use it to create a glowing lantern,as a lantern paint the can with glowinthedark paint and use it to create a glowing lantern,tin can,tin can,0.88649,0.96386,1.0579,0.80093,0.34129,0.81009,-0.04333
30,31,creative,As a phone or speaker holder Use a small can to hold your phone or speaker and listen to music or watch videos handsfree,as a phone or speaker holder use a small can to hold your phone or speaker and listen to music or watch videos handsfree,tin can,tin can,0.81472,1.038,0.94553,0.80093,1.64747,1.04933,-0.05562
31,32,creative,As a wind chime Attach a few tin can lids to the can with string,as a wind chime attach a few tin can lids to the can with string,tin can,tin can,1.15219,0.83963,0.90434,0.80093,0.51993,0.8434,0.05387
32,33,creative,1 A pencil holder or pen holder,a pencil holder or pen holder,tin can,tin can,0.9134599999999999,0.91468,0.92542,0.98731,0.36207,0.82059,-0.07339
33,34,creative,2 A vase for flowers,a vase for flowers,tin can,tin can,0.8635200000000001,0.90833,1.00769,0.7896,1.5135,1.01653,-0.03107
34,35,creative,3 A candle holder or tea light holder,a candle holder or tea light holder,tin can,tin can,1.1402,0.9427,1.0339,1.06223,1.58475,1.15276,0.06131
35,36,creative,4 A storage container for small items such as buttons paper clips or push pins,a storage container for small items such as buttons paper clips or push pins,tin can,tin can,0.8486400000000001,1.01183,1.05725,0.80615,0.36188,0.81715,-0.05895
36,37,creative,5 A container for homemade candles,a container for homemade candles,tin can,tin can,1.10543,1.01977,1.07751,0.82924,1.6374900000000001,1.13389,0.08461
37,38,creative,6 A container for homemade lip balm,a container for homemade lip balm,tin can,tin can,0.7886299999999999,1.01242,1.04151,0.9197,1.6966,1.09177,-0.06881
38,39,creative,7 A container for homemade soap,a container for homemade soap,tin can,tin can,1.09358,0.91738,1.06572,0.82291,1.66082,1.11208,0.07677
39,40,creative,8 A container for homemade potpourri,a container for homemade potpourri,tin can,tin can,1.10597,0.98015,1.00126,0.80823,0.32621,0.84436,0.0442
40,41,creative,9 A container for homemade bath bombs,a container for homemade bath bombs,tin can,tin can,0.8832,1.04175,0.93887,0.84022,0.36138000000000003,0.81308,-0.06311
41,42,creative,10 A container for homemade body scrubs,a container for homemade body scrubs,tin can,tin can,0.8582,1.03011,1.00964,0.89604,1.17183,0.99316,-0.0521
42,43,creative,Make a pencil holder Simply cut a slit in one side of the can insert your pencils and voila You have a new stylish and functional pencil holder,make a pencil holder simply cut a slit in one side of the can insert your pencils and voila you have a new stylish and functional pencil holder,tin can,tin can,0.8353200000000001,0.96207,0.95502,0.80093,1.63765,1.0382,-0.04744
43,44,creative,Make a candle Simply fill a can with wax add a wick and there you have it A homemade candle that smells and looks as good as storebought candles,make a candle simply fill a can with wax add a wick and there you have it a homemade candle that smells and looks as good as storebought candles,tin can,tin can,1.13992,1.02409,0.98229,0.80093,1.63781,1.11701,0.0908
44,45,creative,Make a musical instrument You can easily turn a tin can into a percussion instrument by attaching a rubber mallet or drumstick to it You can also make a whistle or flute out of a tin can,make a musical instrument you can easily turn a tin can into a percussion instrument by attaching a rubber mallet or drumstick to it you can also make a whistle or flute out of a tin can,tin can,tin can,1.09982,1.03797,1.05684,0.80093,1.6378,1.12667,0.08347
45,46,creative,Make a piggy bank This is a great idea for kids and it's a simple project that they can do themselves,make a piggy bank this is a great idea for kids and its a simple project that they can do themselves,tin can,tin can,1.07251,0.95761,0.98672,0.80093,1.6331099999999998,1.09018,0.06019
46,47,creative,Make a watering can Simply cut a small hole in the bottom of an empty tin can then use it to carry water to your plants,make a watering can simply cut a small hole in the bottom of an empty tin can then use it to carry water to your plants,tin can,tin can,1.1514,0.98857,0.98563,0.80093,0.36214999999999997,0.85774,0.06401
47,48,creative,Make an outdoor lamp This is a simple way to illuminate your porch or patio,make an outdoor lamp this is a simple way to illuminate your porch or patio,tin can,tin can,0.95757,0.95511,1.00976,0.80093,1.6392799999999998,1.07253,0.0131
48,49,creative,Make a magnet You can turn a tin can into a beautiful magnet by painting it and gluing a magnet to it,make a magnet you can turn a tin can into a beautiful magnet by painting it and gluing a magnet to it,tin can,tin can,0.88944,0.97926,0.94891,0.80094,1.63787,1.05128,-0.02418
49,50,creative,Make a bird feeder Simply cut a small hole in the top of a tin can then fill it with bird seed Your feathered friends will thank you,make a bird feeder simply cut a small hole in the top of a tin can then fill it with bird seed your feathered friends will thank you,tin can,tin can,1.1522999999999999,1.08774,0.94857,0.80093,1.63781,1.12547,0.09329
50,51,creative,Make a lantern You can use a tin can to create a beautiful and unique lantern Simply paint it and add a batterypowered light inside,make a lantern you can use a tin can to create a beautiful and unique lantern simply paint it and add a batterypowered light inside,tin can,tin can,1.02692,0.99925,1.05697,0.80093,0.35850000000000004,0.84851,0.01921
51,52,creative,1 Turn it into a pencil holder,turn it into a pencil holder,tin can,tin can,0.8250500000000001,0.9355,0.95375,0.80494,0.32967,0.76978,-0.08543
52,53,creative,2 Use it as a flower pot,use it as a flower pot,tin can,tin can,1.06683,0.90399,1.01506,0.80244,0.37132,0.83193,0.02892
53,54,creative,3 Use it as a piggy bank,use it as a piggy bank,tin can,tin can,0.88085,1.0719,1.04338,0.79301,0.75258,0.90834,-0.03396
54,55,creative,4 Use it as a desk organizer,use it as a desk organizer,tin can,tin can,0.92108,1.06521,1.08063,0.80386,0.45519,0.86519,-0.02031
55,56,creative,5 Use it as a storage container for small items,use it as a storage container for small items,tin can,tin can,1.14473,0.98672,0.94778,0.80177,1.66747,1.10969,0.08805
56,57,creative,6 Use it as a decorative vase,use it as a decorative vase,tin can,tin can,0.99091,0.99591,0.9713,0.80071,1.50141,1.05205,0.02021
57,58,creative,7 Use it as a wastebasket,use it as a wastebasket,tin can,tin can,0.76924,0.98466,0.97273,0.79909,0.30127000000000004,0.7654,-0.10608
58,59,creative,8 Use it as a soap dispenser,use it as a soap dispenser,tin can,tin can,0.89314,1.00477,0.9172,0.8002,1.60745,1.04455,-0.02679
59,60,creative,9 Use it as a plant holder,use it as a plant holder,tin can,tin can,0.97345,1.0278,0.99889,0.81042,0.29928,0.82197,-0.01381
60,61,creative,10 Use it as a candle holder,use it as a candle holder,tin can,tin can,0.82311,1.03092,0.97795,0.79729,0.46072,0.818,-0.07657
61,62,creative,Make a wind chime by punching holes in the can and hanging it from a string,make a wind chime by punching holes in the can and hanging it from a string,tin can,tin can,0.84767,0.96149,1.0752,0.80094,0.36544,0.81015,-0.05747
62,63,creative,Paint the can and use it as a pencil holder,paint the can and use it as a pencil holder,tin can,tin can,0.79671,0.99999,0.95118,0.80094,0.30457999999999996,0.77068,-0.09671
63,64,creative,Turn it into a planter by punching holes in the bottom and filling it with soil,turn it into a planter by punching holes in the bottom and filling it with soil,tin can,tin can,0.8725700000000001,1.03958,0.98024,0.80093,1.68222,1.07511,-0.02485
64,65,creative,Use as a storage container for small items such as nails or screws,use as a storage container for small items such as nails or screws,tin can,tin can,1.15129,0.98926,0.94307,0.8016,1.6920899999999999,1.11546,0.09099
65,66,creative,Turn it into a pencil holder by cutting a small hole in the lid and inserting the pencils,turn it into a pencil holder by cutting a small hole in the lid and inserting the pencils,tin can,tin can,0.87293,0.94777,1.01018,0.80093,0.36716000000000004,0.79979,-0.05532
66,67,creative,Make a candle holder by painting the can and placing a candle inside,make a candle holder by painting the can and placing a candle inside,tin can,tin can,1.15557,1.034,0.99101,0.80002,1.6417899999999999,1.12448,0.09925
67,68,creative,Use as a portable ashtray by punching a few holes in the can and filling it with sand,use as a portable ashtray by punching a few holes in the can and filling it with sand,tin can,tin can,0.84949,1.04049,1.01803,0.80093,1.63835,1.06946,-0.031
68,69,creative,Use as a container for storing dry goods such as flour sugar or spices,use as a container for storing dry goods such as flour sugar or spices,tin can,tin can,0.8520300000000001,1.03556,0.94668,0.8010200000000001,0.30893000000000004,0.78884,-0.07216
69,70,creative,Make a musical instrument by attaching a stick to the lid and using it as a drum,make a musical instrument by attaching a stick to the lid and using it as a drum,tin can,tin can,0.9455,1.03793,0.96531,0.80093,0.50705,0.85134,-0.0239
70,71,creative,Use as a portable speaker by attaching a small speaker to the can,use as a portable speaker by attaching a small speaker to the can,tin can,tin can,1.12794,1.03762,0.94675,0.80098,1.68837,1.12033,0.08243
71,72,creative,Use it as a storage container for coins keys or other small items,use it as a storage container for coins keys or other small items,tin can,tin can,1.15076,0.99841,0.94569,0.80091,1.64388,1.10793,0.09022
72,73,creative,Use them to store small items such as nuts bolts and nails,use them to store small items such as nuts bolts and nails,tin can,tin can,0.8472500000000001,1.11072,0.95021,0.80093,0.30189,0.8022,-0.07212
73,74,creative,Use them to make wind chimes,use them to make wind chimes,tin can,tin can,0.86799,1.07689,0.93016,0.80575,0.70016,0.87619,-0.05734
74,75,creative,Use them to make pencil holders,use them to make pencil holders,tin can,tin can,0.97964,0.95433,0.95789,0.81748,0.32345999999999997,0.80656,-0.01861
75,76,creative,Use them to make lanterns,use them to make lanterns,tin can,tin can,1.06191,1.04565,1.058,0.8001,1.51895,1.09692,0.06442
76,77,creative,Use them to make planters,use them to make planters,tin can,tin can,1.14298,0.96527,0.9705,0.80437,0.99033,0.97469,0.07278
77,78,creative,Use them to make storage containers for small items such as buttons beads or pins,use them to make storage containers for small items such as buttons beads or pins,tin can,tin can,1.15136,0.91071,0.94255,0.80077,1.63842,1.08876,0.08783
78,79,creative,Use them to make bird houses,use them to make bird houses,tin can,tin can,0.8678,0.98801,0.9161,0.81231,0.34974000000000005,0.78679,-0.0709
79,80,creative,Use them to make candle holders,use them to make candle holders,tin can,tin can,0.82952,0.97462,0.97585,0.80968,0.37977000000000005,0.79389,-0.07898
80,81,creative,Use them to make a piggy bank,use them to make a piggy bank,tin can,tin can,0.8962,0.95359,0.97238,0.79772,1.46652,1.01728,-0.02255
81,82,creative,Use them to make a mailbox,use them to make a mailbox,tin can,tin can,0.76691,0.95897,0.94709,0.8009,0.37622999999999995,0.77002,-0.1095
82,83,creative,A pencil holder,a pencil holder,tin can,tin can,0.85663,0.98983,0.98489,0.98025,1.42255,1.04683,-0.06155
83,84,creative,A planter for flowers or herbs,a planter for flowers or herbs,tin can,tin can,0.86042,0.8340799999999999,0.97473,0.80173,1.6447,1.02313,-0.0369
84,85,creative,A storage container for small items such as buttons or paperclips,a storage container for small items such as buttons or paperclips,tin can,tin can,1.15175,1.03148,0.94303,0.79222,0.352,0.8541,0.06042
85,86,creative,A decorative candle holder,a decorative candle holder,tin can,tin can,0.96712,1.12129,0.99472,0.98979,0.42850999999999995,0.90029,-0.03444
86,87,creative,A wind chime,a wind chime,tin can,tin can,1.11045,1.00163,0.94887,0.8351999999999999,1.24137,1.0275,0.05885
87,88,creative,A bird feeder,a bird feeder,tin can,tin can,0.96586,1.0796000000000001,1.09263,1.02209,0.55748,0.94353,-0.02398
88,89,creative,A lantern,a lantern,tin can,tin can,0.83474,0.97404,0.95024,0.80755,0.70147,0.85361,-0.07191
89,90,creative,A pencil sharpener,a pencil sharpener,tin can,tin can,0.92648,0.80596,0.94695,0.93274,0.8797,0.89837,-0.04783
90,91,creative,A coin bank,a coin bank,tin can,tin can,0.8587,0.99106,0.94365,1.1004,1.5206499999999998,1.08289,-0.0789
91,92,creative,A trash can,a trash can,tin can,tin can,0.95508,0.85041,1.05213,0.90527,1.6468500000000001,1.08195,0.00202
92,93,creative,Planter for herbs or flowers Decorate the can with paint or stickers and add some drainage holes,planter for herbs or flowers decorate the can with paint or stickers and add some drainage holes,tin can,tin can,1.14444,0.7541,0.94259,0.80095,0.36219,0.80085,0.04958
93,94,creative,Wind chime Attach various objects to the can such as beads bells or shells to create a unique sound,wind chime attach various objects to the can such as beads bells or shells to create a unique sound,tin can,tin can,0.84856,0.96222,1.05755,0.8010200000000001,1.6369500000000001,1.06126,-0.02812
94,95,creative,Storage container Use a permanent marker or paint to decorate the outside and use it to store small items,storage container use a permanent marker or paint to decorate the outside and use it to store small items,tin can,tin can,1.14661,0.96135,1.05735,0.80094,1.63778,1.12081,0.10212
95,96,creative,Pencil holder Cut a small hole in the side of the can and use it as a place to store and organize pencils pens and other writing tools,pencil holder cut a small hole in the side of the can and use it as a place to store and organize pencils pens and other writing tools,tin can,tin can,0.84845,0.95779,1.00658,0.80093,1.6372200000000001,1.05019,-0.035
96,97,creative,Lantern Decorate the can with paint or stickers and use it as a light fixture,lantern decorate the can with paint or stickers and use it as a light fixture,tin can,tin can,1.1233900000000001,1.03842,1.05683,0.80094,1.63781,1.13148,0.09378
97,98,creative,Bird feeder Decorate the can with paint or stickers and fill it with birdseed,bird feeder decorate the can with paint or stickers and fill it with birdseed,tin can,tin can,0.85012,1.02384,0.93072,0.80094,0.36219,0.79356,-0.07407
98,99,creative,Organizer Use the can to organize small items such as screws nails or jewelry,organizer use the can to organize small items such as screws nails or jewelry,tin can,tin can,0.84939,0.92928,1.05805,0.80079,0.37959,0.80342,-0.0594
99,100,creative,Portable speaker Decorate the can with paint or stickers and use it to amplify the sound of your phone or music player,portable speaker decorate the can with paint or stickers and use it to amplify the sound of your phone or music player,tin can,tin can,0.98212,1.03735,0.9413,0.80093,1.63781,1.0799,0.01673
100,101,creative,Watering can Decorate the can with paint or stickers and use it to give plants a drink of water,watering can decorate the can with paint or stickers and use it to give plants a drink of water,tin can,tin can,1.18414,0.96178,0.9424,0.80093,1.63781,1.10541,0.10334
101,102,creative,Wastebasket Decorate the can with paint or stickers and use it to collect garbage,wastebasket decorate the can with paint or stickers and use it to collect garbage,tin can,tin can,0.81265,0.96144,1.05565,0.80093,1.63781,1.0537,-0.04405
102,103,creative,Create a wind chime by attaching several tin cans of different sizes to a wooden dowel and hanging them from a hook,create a wind chime by attaching several tin cans of different sizes to a wooden dowel and hanging them from a hook,tin can,tin can,1.15131,1.04248,1.05397,0.80094,1.63785,1.13731,0.1057
103,104,creative,Make a rain gauge by cutting a small hole in the top of the can and marking the water level on the outside with a piece of tape,make a rain gauge by cutting a small hole in the top of the can and marking the water level on the outside with a piece of tape,tin can,tin can,0.92761,1.05779,0.99048,0.80093,0.36204000000000003,0.82777,-0.03148
104,105,creative,Use a tin can as a planter by punching a few drainage holes in the bottom and filling it with soil and a plant,use a tin can as a planter by punching a few drainage holes in the bottom and filling it with soil and a plant,tin can,tin can,0.84861,1.03569,0.93667,0.80093,1.6507100000000001,1.05452,-0.04195
105,106,creative,Use a tin can to make a mini fire pit by lining the bottom with rocks or sand filling it with firewood and lighting it with a match,use a tin can to make a mini fire pit by lining the bottom with rocks or sand filling it with firewood and lighting it with a match,tin can,tin can,1.1117,1.0606,0.95722,0.80093,0.36219999999999997,0.85853,0.04465
106,107,creative,Make a musical instrument by attaching a metal rod to the inside of the can and using it as a drum,make a musical instrument by attaching a metal rod to the inside of the can and using it as a drum,tin can,tin can,0.89757,1.03801,1.00108,0.80093,1.63819,1.07516,-0.01229
107,108,creative,Use a tin can to make a miniature grill by lining the bottom with aluminum foil and placing charcoal briquettes inside,use a tin can to make a miniature grill by lining the bottom with aluminum foil and placing charcoal briquettes inside,tin can,tin can,0.91104,0.94984,0.99322,0.80086,0.36221000000000003,0.80343,-0.04097
