...1,id,condition,response,response_clean,item,item_clean,SemDis_cbowukwacsubtitle_c_m,SemDis_cbowsubtitle_c_m,SemDis_cbowBNCwikiukwac_c_m,SemDis_TASA_c_m,SemDis_glove_c_m,SemDis_MEAN,SemDis_factor
214,215,creative,9 Use it as a mini greenhouse by cutting out a hole in the side of the can and using it as a container for seedlings,use it as a mini greenhouse by cutting out a hole in the side of the can and using it as a container for seedlings,tin can,tin can,1.13746,0.96273,1.00823,0.80093,1.6342400000000001,1.10872,0.09158
215,216,creative,10 Use it as a bird feeder by cutting out a hole in the side of the can and using it as a container for birdseed,use it as a bird feeder by cutting out a hole in the side of the can and using it as a container for birdseed,tin can,tin can,0.91574,0.97504,0.99501,0.80093,1.6349200000000002,1.06433,-0.00676
216,217,creative,Make a pencil holder,make a pencil holder,tin can,tin can,0.86395,0.92544,0.96646,0.83595,0.34026999999999996,0.78641,-0.07067
217,218,creative,Make a wind chime,make a wind chime,tin can,tin can,0.84243,0.89959,1.00686,0.88008,0.7091700000000001,0.86763,-0.07188
218,219,creative,Make a lantern,make a lantern,tin can,tin can,0.90926,0.94768,0.96021,0.81469,1.36192,0.99875,-0.02332
219,220,creative,Make a planter,make a planter,tin can,tin can,1.05473,0.86509,1.00481,0.95233,0.5008600000000001,0.87556,0.0055
220,221,creative,Make a bird feeder,make a bird feeder,tin can,tin can,0.9250700000000001,0.9252,0.98721,0.95282,1.57593,1.07325,-0.02565
221,222,creative,Make a storage container,make a storage container,tin can,tin can,0.84459,0.94897,0.91643,0.88434,0.29562,0.77799,-0.09242
222,223,creative,Make a candle holder,make a candle holder,tin can,tin can,0.76759,1.00739,0.99055,0.92223,0.46355,0.83026,-0.11552
223,224,creative,Make a trash can,make a trash can,tin can,tin can,0.68685,0.80873,0.9176,0.77295,0.35523000000000005,0.70827,-0.149
224,225,creative,Make a musical instrument eg a drum,make a musical instrument eg a drum,tin can,tin can,0.96558,1.03352,1.01793,1.08899,0.35871,0.89295,-0.04848
225,226,creative,Make a utensil holder,make a utensil holder,tin can,tin can,0.83365,1.0238,0.9082,0.87336,1.46683,1.02117,-0.06626
226,227,creative,Make a DIY lamp by drilling a small hole in the side of a tin can and inserting a light bulb and cord,make a diy lamp by drilling a small hole in the side of a tin can and inserting a light bulb and cord,tin can,tin can,1.07378,1.06556,1.02142,0.80094,1.63959,1.12026,0.06812
227,228,creative,Create a DIY guitar by attaching a guitar string to the side of a tin can and using it as a makeshift pick,create a diy guitar by attaching a guitar string to the side of a tin can and using it as a makeshift pick,tin can,tin can,1.0628,0.96143,1.05816,0.80093,0.36219,0.8491,0.03422
228,229,creative,Use a large tin can as a planter for small plants or flowers,use a large tin can as a planter for small plants or flowers,tin can,tin can,1.15119,0.94389,0.96661,0.80091,0.35989000000000004,0.8445,0.06026
229,230,creative,Use a small tin can as a pencil holder,use a small tin can as a pencil holder,tin can,tin can,0.8579,1.10099,1.05265,0.80157,1.66989,1.0966,-0.02058
230,231,creative,Use a large tin can as a trash can,use a large tin can as a trash can,tin can,tin can,1.16851,0.88223,0.96108,0.8008500000000001,1.63888,1.09031,0.09708
231,232,creative,Use a small tin can as a storage container for small items such as pens and pencils,use a small tin can as a storage container for small items such as pens and pencils,tin can,tin can,1.15127,0.92822,1.0576699999999999,0.80093,0.36539,0.8607,0.07209
232,233,creative,Use a large tin can as a storage container for larger items such as tools or toys,use a large tin can as a storage container for larger items such as tools or toys,tin can,tin can,1.15087,1.10508,1.05664,0.8009,1.64021,1.15074,0.10745
233,234,creative,Use a small tin can as a candle holder,use a small tin can as a candle holder,tin can,tin can,1.03844,1.13391,0.97699,0.80165,1.62386,1.11497,0.04798
234,235,creative,Use a large tin can as a storage container for pet food,use a large tin can as a storage container for pet food,tin can,tin can,0.84988,0.97637,1.02518,0.80219,0.35404,0.80153,-0.0632
235,236,creative,Use a small tin can as a place to keep spare change,use a small tin can as a place to keep spare change,tin can,tin can,0.78364,1.03739,1.01885,0.80094,0.35379000000000005,0.79892,-0.09135
236,237,creative,Build a tin can robot,build a tin can robot,tin can,tin can,0.87781,1.05807,0.9101,0.89838,1.6875900000000001,1.08639,-0.04362
237,238,creative,Make a planter out of a tin can,make a planter out of a tin can,tin can,tin can,0.85737,0.99713,1.02867,0.80113,1.70149,1.07716,-0.02567
238,239,creative,Use tin cans as storage for small items,use tin cans as storage for small items,tin can,tin can,0.82793,0.92779,1.06977,0.79222,0.36378999999999995,0.7963,-0.06657
239,240,creative,Turn a tin can into a pencil holder,turn a tin can into a pencil holder,tin can,tin can,0.63394,1.04319,0.81853,0.79831,0.30925,0.72064,-0.18389
240,241,creative,Use tin cans as organizers for craft supplies,use tin cans as organizers for craft supplies,tin can,tin can,0.86368,0.8557,0.93537,0.92589,0.36277000000000004,0.78868,-0.08745
241,242,creative,Turn a tin can into a lantern,turn a tin can into a lantern,tin can,tin can,1.13787,0.84715,1.07579,0.7999499999999999,1.56863,1.08588,0.0964
242,243,creative,Use tin cans as decorations for a party or holiday,use tin cans as decorations for a party or holiday,tin can,tin can,1.11806,0.91501,0.93366,0.80091,0.36260000000000003,0.82605,0.04079
243,244,creative,Use tin cans as containers for homemade candles,use tin cans as containers for homemade candles,tin can,tin can,0.82709,1.02234,0.95291,0.96694,0.36214999999999997,0.82629,-0.1023
244,245,creative,Use tin cans as containers for homemade ice cream,use tin cans as containers for homemade ice cream,tin can,tin can,1.15313,1.0805,0.97764,0.88514,1.6378300000000001,1.14685,0.08664
245,246,creative,Use tin cans for a musical project such as making a tin can drum or a tin can guitar,use tin cans for a musical project such as making a tin can drum or a tin can guitar,tin can,tin can,1.17698,0.96253,1.01999,0.80094,1.63781,1.11965,0.11049
246,247,creative,Create a miniature herb garden,create a miniature herb garden,tin can,tin can,0.84188,0.98642,1.03964,0.95098,1.61293,1.08637,-0.05244
247,248,creative,Turn it into a pencil holder,turn it into a pencil holder,tin can,tin can,0.8250500000000001,0.9355,0.95375,0.80494,0.32967,0.76978,-0.08543
248,249,creative,Make a small lantern with a tea candle inside,make a small lantern with a tea candle inside,tin can,tin can,1.13569,1.01422,0.97475,0.80055,1.6431,1.11366,0.08789
249,250,creative,Use it as a portable speaker by attaching a speaker to the inside of the can,use it as a portable speaker by attaching a speaker to the inside of the can,tin can,tin can,1.00392,1.03639,1.05772,0.80094,0.32432000000000005,0.84466,0.00931
250,251,creative,Make a small bookshelf by stacking several cans on top of each other,make a small bookshelf by stacking several cans on top of each other,tin can,tin can,1.15648,1.08464,0.94382,0.80093,0.36597,0.87037,0.06312
251,252,creative,Use it as a piggy bank or a money jar,use it as a piggy bank or a money jar,tin can,tin can,0.83945,0.95422,1.01536,0.8009,0.40793999999999997,0.80357,-0.0681
252,253,creative,Create a miniature drum by attaching a drumhead to the can,create a miniature drum by attaching a drumhead to the can,tin can,tin can,0.81867,1.02614,1.02456,0.8016,0.35068,0.80433,-0.07572
253,254,creative,Turn it into a portable survival kit,turn it into a portable survival kit,tin can,tin can,0.9933,0.9986,1.0311,0.79981,1.68857,1.10228,0.03395
254,255,creative,Use it as a storage container for small items such as screws or nails,use it as a storage container for small items such as screws or nails,tin can,tin can,0.84865,1.0279,1.05694,0.80101,0.30578000000000005,0.80806,-0.05932
255,256,creative,Paint it and turn it into a decorative planter,paint it and turn it into a decorative planter,tin can,tin can,1.08177,1.06216,1.05627,0.80094,0.31899999999999995,0.86403,0.04364
